<?xml version="1.0" encoding="UTF-8"?>
<xs:schema xmlns:xs="http://www.w3.org/2001/XMLSchema" 
			elementFormDefault="qualified" 
			targetNamespace="http://example.org/ticket"
			xmlns:tn="http://example.org/ticket">

	<xs:element name="userdb">
		<xs:complexType>
			<xs:sequence>
				<xs:element name="user" type="tn:ct_profile" minOccurs="0" maxOccurs="unbounded"/>
			</xs:sequence>
		</xs:complexType>
	</xs:element>
	
	<xs:complexType name="ct_profile">
		<xs:sequence>
			<xs:element name="id" type="xs:nonNegativeInteger"/>
			<xs:element name="Vorname" type="xs:string"/>
			<xs:element name="Nachname" type="xs:string"/>
			<xs:element name="Standort" type="xs:string"/>
			<xs:element name="status" type="xs:string"/>
			<xs:element name="KnowHows" minOccurs="0">
				<xs:complexType>
					<xs:sequence>
						<xs:element name="KnowHow" type="tn:stknowhow" minOccurs="1" maxOccurs="unbounded"/>
					</xs:sequence>
				</xs:complexType>
			</xs:element>
			<xs:element name="Tickets" type="tn:cttickets"/>
		</xs:sequence>
	</xs:complexType>
	
	<xs:complexType name="cttickets">
		<xs:sequence>
			<xs:element name="ticketId" type="xs:nonNegativeInteger" minOccurs="0" maxOccurs="unbounded"/>
		</xs:sequence>
	</xs:complexType>
	
	<xs:simpleType name="stknowhow">
		<xs:restriction base="xs:string">
			<xs:enumeration value="Hardware"/>
			<xs:enumeration value="Software"/>
			<xs:enumeration value="OSX"/>
			<xs:enumeration value="Windows"/>
			<xs:enumeration value="Netzwerk"/>
		</xs:restriction>
	</xs:simpleType>
</xs:schema>
