<?xml version="1.0" encoding="UTF-8" standalone="yes"?>
<userdb xmlns="http://example.org/ticket" xmlns:xsi="http://www.w3.org/2001/XMLSchema-instance" xsi:schemaLocation="http://example.org/ticket ../schema/UListeSchema.xsd">
    <user>
        <id>1</id>
        <jabber>admin</jabber>
        <Vorname>Max</Vorname>
        <Nachname>Mustermann</Nachname>
        <Standort>CGN</Standort>
        <status>admin</status>
        <KnowHows>
            <KnowHow>Software</KnowHow>
        </KnowHows>
        <Tickets>
            <ticketId>3</ticketId>
            <ticketId>4</ticketId>
            <ticketId>6</ticketId>
            <ticketId>7</ticketId>
            <ticketId>8</ticketId>
            <ticketId>9</ticketId>
        </Tickets>
    </user>
    <user>
        <id>2</id>
        <jabber>null</jabber>
        <Vorname>Michael</Vorname>
        <Nachname>Schmidt</Nachname>
        <Standort>HAM</Standort>
        <status>user</status>
        <Tickets/>
    </user>
    <user>
        <id>3</id>
        <jabber>ollsen</jabber>
        <Vorname>Michael</Vorname>
        <Nachname>Schmidt</Nachname>
        <Standort>NBG</Standort>
        <status>supporter</status>
        <KnowHows>
            <KnowHow>Hardware</KnowHow>
            <KnowHow>Software</KnowHow>
            <KnowHow>Windows</KnowHow>
        </KnowHows>
        <Tickets>
            <ticketId>3</ticketId>
            <ticketId>4</ticketId>
            <ticketId>6</ticketId>
            <ticketId>7</ticketId>
            <ticketId>8</ticketId>
            <ticketId>9</ticketId>
        </Tickets>
    </user>
    <user>
        <id>4</id>
        <jabber>null</jabber>
        <Vorname>Vorname</Vorname>
        <Nachname>Nachname</Nachname>
        <Standort>CGN</Standort>
        <status>supporter</status>
        <KnowHows>
            <KnowHow>Hardware</KnowHow>
            <KnowHow>Software</KnowHow>
        </KnowHows>
        <Tickets/>
    </user>
</userdb>
